{
  "competition_id": "germany-bundesliga",
  "competition_name": "Bundesliga",
  "coverage": {
    "events": 519407,
    "matches": 306,
    "teams": 18
  },
  "era": "2017/18",
  "label": "Historical team research \u2014 never a live model input",
  "methods": {
    "chain_proxy": "consecutive same-team event run; a transparent proxy, not provider possession",
    "progressive_pass": "successful pass with normalized attacking x gain >= 20",
    "research_xt": "own 12x8 transition grid trained within this competition slice; positive completed-pass gains only"
  },
  "provenance": {
    "attribution": "Event data: Pappalardo et al., Scientific Data 6:236 (2019), CC BY 4.0 (collected by Wyscout).",
    "license": "CC-BY-4.0",
    "modifications": "Golavo aggregated raw events to competition-era team summaries; player identities and raw events are not redistributed.",
    "source_id": "pappalardo-wyscout-events"
  },
  "schema_version": "0.1.0",
  "status": "available",
  "team_scope": "team_aggregate_only",
  "teams": [
    {
      "chain_proxy_count": 12592,
      "chain_proxy_events": 26938,
      "goals_per_match": 1.21,
      "matches": 34,
      "pass_completion_pct": 77.1,
      "passes_attempted": 12100,
      "passes_completed": 9334,
      "progressive_chains_per_match": 101.56,
      "progressive_passes_per_match": 43.74,
      "research_xt_created_per_match": 1.959,
      "shots_per_match": 12.32,
      "team": "Augsburg",
      "team_id": 2481
    },
    {
      "chain_proxy_count": 12368,
      "chain_proxy_events": 30243,
      "goals_per_match": 1.71,
      "matches": 34,
      "pass_completion_pct": 84.6,
      "passes_attempted": 16272,
      "passes_completed": 13763,
      "progressive_chains_per_match": 90.09,
      "progressive_passes_per_match": 45.65,
      "research_xt_created_per_match": 2.369,
      "shots_per_match": 14.12,
      "team": "Bayer Leverkusen",
      "team_id": 2446
    },
    {
      "chain_proxy_count": 11034,
      "chain_proxy_events": 34063,
      "goals_per_match": 2.65,
      "matches": 34,
      "pass_completion_pct": 88.2,
      "passes_attempted": 22015,
      "passes_completed": 19415,
      "progressive_chains_per_match": 85.12,
      "progressive_passes_per_match": 56.35,
      "research_xt_created_per_match": 3.209,
      "shots_per_match": 16.62,
      "team": "Bayern M\\u00fcnchen",
      "team_id": 2444
    },
    {
      "chain_proxy_count": 12089,
      "chain_proxy_events": 31560,
      "goals_per_match": 1.82,
      "matches": 34,
      "pass_completion_pct": 85.3,
      "passes_attempted": 18225,
      "passes_completed": 15545,
      "progressive_chains_per_match": 89.03,
      "progressive_passes_per_match": 45.62,
      "research_xt_created_per_match": 2.363,
      "shots_per_match": 13.15,
      "team": "Borussia Dortmund",
      "team_id": 2447
    },
    {
      "chain_proxy_count": 11868,
      "chain_proxy_events": 29827,
      "goals_per_match": 1.35,
      "matches": 34,
      "pass_completion_pct": 84.6,
      "passes_attempted": 15996,
      "passes_completed": 13540,
      "progressive_chains_per_match": 87.71,
      "progressive_passes_per_match": 45.71,
      "research_xt_created_per_match": 1.926,
      "shots_per_match": 12.56,
      "team": "Borussia M'gladbach",
      "team_id": 2454
    },
    {
      "chain_proxy_count": 12818,
      "chain_proxy_events": 28125,
      "goals_per_match": 1.29,
      "matches": 34,
      "pass_completion_pct": 80.1,
      "passes_attempted": 13312,
      "passes_completed": 10668,
      "progressive_chains_per_match": 100.91,
      "progressive_passes_per_match": 48.79,
      "research_xt_created_per_match": 1.968,
      "shots_per_match": 10.56,
      "team": "Eintracht Frankfurt",
      "team_id": 2462
    },
    {
      "chain_proxy_count": 11968,
      "chain_proxy_events": 26907,
      "goals_per_match": 0.94,
      "matches": 34,
      "pass_completion_pct": 81.2,
      "passes_attempted": 12605,
      "passes_completed": 10236,
      "progressive_chains_per_match": 93.53,
      "progressive_passes_per_match": 42.0,
      "research_xt_created_per_match": 1.577,
      "shots_per_match": 10.76,
      "team": "Freiburg",
      "team_id": 2453
    },
    {
      "chain_proxy_count": 13418,
      "chain_proxy_events": 28529,
      "goals_per_match": 0.82,
      "matches": 34,
      "pass_completion_pct": 77.9,
      "passes_attempted": 12535,
      "passes_completed": 9769,
      "progressive_chains_per_match": 106.53,
      "progressive_passes_per_match": 42.97,
      "research_xt_created_per_match": 1.834,
      "shots_per_match": 10.5,
      "team": "Hamburger SV",
      "team_id": 2450
    },
    {
      "chain_proxy_count": 13192,
      "chain_proxy_events": 28043,
      "goals_per_match": 1.29,
      "matches": 34,
      "pass_completion_pct": 78.8,
      "passes_attempted": 12534,
      "passes_completed": 9877,
      "progressive_chains_per_match": 101.38,
      "progressive_passes_per_match": 44.03,
      "research_xt_created_per_match": 1.867,
      "shots_per_match": 12.12,
      "team": "Hannover 96",
      "team_id": 2455
    },
    {
      "chain_proxy_count": 12209,
      "chain_proxy_events": 27621,
      "goals_per_match": 1.26,
      "matches": 34,
      "pass_completion_pct": 81.7,
      "passes_attempted": 13520,
      "passes_completed": 11049,
      "progressive_chains_per_match": 94.12,
      "progressive_passes_per_match": 43.5,
      "research_xt_created_per_match": 1.709,
      "shots_per_match": 9.03,
      "team": "Hertha BSC",
      "team_id": 2457
    },
    {
      "chain_proxy_count": 12152,
      "chain_proxy_events": 29633,
      "goals_per_match": 1.88,
      "matches": 34,
      "pass_completion_pct": 83.6,
      "passes_attempted": 15420,
      "passes_completed": 12895,
      "progressive_chains_per_match": 90.18,
      "progressive_passes_per_match": 49.56,
      "research_xt_created_per_match": 2.167,
      "shots_per_match": 13.53,
      "team": "Hoffenheim",
      "team_id": 2482
    },
    {
      "chain_proxy_count": 12554,
      "chain_proxy_events": 27895,
      "goals_per_match": 0.97,
      "matches": 34,
      "pass_completion_pct": 81.1,
      "passes_attempted": 13474,
      "passes_completed": 10927,
      "progressive_chains_per_match": 99.88,
      "progressive_passes_per_match": 47.94,
      "research_xt_created_per_match": 2.02,
      "shots_per_match": 10.91,
      "team": "K\\u00f6ln",
      "team_id": 2463
    },
    {
      "chain_proxy_count": 13020,
      "chain_proxy_events": 27223,
      "goals_per_match": 1.12,
      "matches": 34,
      "pass_completion_pct": 79.0,
      "passes_attempted": 11832,
      "passes_completed": 9344,
      "progressive_chains_per_match": 99.38,
      "progressive_passes_per_match": 39.71,
      "research_xt_created_per_match": 1.61,
      "shots_per_match": 11.88,
      "team": "Mainz 05",
      "team_id": 2460
    },
    {
      "chain_proxy_count": 13157,
      "chain_proxy_events": 30731,
      "goals_per_match": 1.65,
      "matches": 34,
      "pass_completion_pct": 81.8,
      "passes_attempted": 15826,
      "passes_completed": 12942,
      "progressive_chains_per_match": 99.32,
      "progressive_passes_per_match": 47.12,
      "research_xt_created_per_match": 2.197,
      "shots_per_match": 13.53,
      "team": "RB Leipzig",
      "team_id": 2975
    },
    {
      "chain_proxy_count": 12614,
      "chain_proxy_events": 28028,
      "goals_per_match": 1.44,
      "matches": 34,
      "pass_completion_pct": 82.7,
      "passes_attempted": 13613,
      "passes_completed": 11252,
      "progressive_chains_per_match": 91.56,
      "progressive_passes_per_match": 42.09,
      "research_xt_created_per_match": 1.638,
      "shots_per_match": 11.09,
      "team": "Schalke 04",
      "team_id": 2449
    },
    {
      "chain_proxy_count": 12362,
      "chain_proxy_events": 27933,
      "goals_per_match": 1.03,
      "matches": 34,
      "pass_completion_pct": 81.6,
      "passes_attempted": 13986,
      "passes_completed": 11409,
      "progressive_chains_per_match": 95.09,
      "progressive_passes_per_match": 44.0,
      "research_xt_created_per_match": 1.783,
      "shots_per_match": 9.94,
      "team": "Stuttgart",
      "team_id": 2445
    },
    {
      "chain_proxy_count": 12374,
      "chain_proxy_events": 28085,
      "goals_per_match": 1.0,
      "matches": 34,
      "pass_completion_pct": 80.3,
      "passes_attempted": 13810,
      "passes_completed": 11085,
      "progressive_chains_per_match": 95.94,
      "progressive_passes_per_match": 47.24,
      "research_xt_created_per_match": 2.014,
      "shots_per_match": 11.65,
      "team": "Werder Bremen",
      "team_id": 2443
    },
    {
      "chain_proxy_count": 11717,
      "chain_proxy_events": 28023,
      "goals_per_match": 1.06,
      "matches": 34,
      "pass_completion_pct": 82.9,
      "passes_attempted": 14387,
      "passes_completed": 11929,
      "progressive_chains_per_match": 95.97,
      "progressive_passes_per_match": 47.88,
      "research_xt_created_per_match": 1.773,
      "shots_per_match": 10.15,
      "team": "Wolfsburg",
      "team_id": 2451
    }
  ]
}
